[
  {
    "@context": [
      "https://w3id.org/traceability/v1"
    ],
    "type": "ContactPoint",
    "name": "Christiansen - Glover",
    "address": {
      "type": "PostalAddress",
      "streetAddress": "7072 Sonny Pike",
      "addressLocality": "New Rogerview",
      "addressRegion": "Alabama",
      "postalCode": "29703",
      "addressCountry": "Ukraine"
    },
    "email": "Rory57@example.com",
    "phoneNumber": "555-191-8440"
  },
  {
    "@context": [
      "https://w3id.org/traceability/v1"
    ],
    "type": "ContactPoint",
    "name": "Glover Inc",
    "address": {
      "type": "PostalAddress",
      "streetAddress": "9687 Conn Ranch",
      "addressLocality": "East Metahaven",
      "addressRegion": "North Dakota",
      "postalCode": "92719",
      "addressCountry": "Pakistan"
    },
    "email": "Oswald_Nicolas@example.com",
    "phoneNumber": "555-732-9495"
  },
  {
    "@context": [
      "https://w3id.org/traceability/v1"
    ],
    "type": "ContactPoint",
    "name": "Pagac, Romaguera and Mohr",
    "address": {
      "type": "PostalAddress",
      "streetAddress": "26373 Stokes Alley",
      "addressLocality": "Denesikbury",
      "addressRegion": "Nevada",
      "postalCode": "48723-6847",
      "addressCountry": "Tanzania"
    },
    "email": "Eleazar93@example.org",
    "phoneNumber": "555-682-2941"
  }
]